media_id,media_type,author,rating,content,created_at
539,movie,CinemaSerf,8.0,"There is so much more to this film than just that famous scene in the shower - and so much of it belongs to the marvellous scoring of Bernard Herrmann. His ability to use those screeching strings, and the pace of his music does so much of the heavy lifting that gives this film a sense of accumulating menace that makes it still, after over 60 years, a masterful piece of cinema. Janet Leigh wants to make a go of things with her cash-strapped hunky boyfriend ""Sam"" (John Gavin) so when an unexpected",2022-05-29
510,movie,Charles Dance,8.0,"**Subject to the silliest of internet theories**

There are a lot of movie theories but the silliest of all is this nonsense that is all over the internet claiming that _the Chief killed the unresponsive McMurphy because he thought McMurphy was ignoring him._ 

These idiots claim the Chief did not notice the scars on McMurphy's head and simply thought the unresponsive McMurphy was ignoring him - so the Chief kills him in a fit of rage. Ridiculous.

The Chief killed McMurphy as an act of _k",2017-02-17
510,movie,Wuchak,9.0,"***The spirit of freedom vs. the spirit of legal-ism***

Set in the early 60s, the story involves R.P. McMurphy (Jack Nicholson) and his arrival at a mental institution in Salem, Oregon (where the film was shot). He plays the ""mental illness"" card to get out of prison time, thinking it'll be a piece of cake, but he's wrong, very wrong. Everything appears well at the hospital and Nurse Ratched (Louise Fletcher) seems to be a benevolent overseer of McMurphy's ward, but there are sinister things ",2020-02-13
510,movie,wizzardss,8.0,"_One Flew Over The Cuckoo's Nest_ tells the story of a criminal, Randle Patrick McMurphy (Jack Nicholson), who pleads insanity in the attempt to get a more lenient sentence. Sent to a mental hospital, he livens up the otherwise monotonous lives of the patients, much to the ire of the strict head nurse, Mildred Ratched (Louise Fletcher).

_One Flew Over The Cuckoo's Nest_ clean swept the Oscars in 1976, taking home the five biggest prizes as only the second film to do so since It Happened One N",2021-02-25
510,movie,CinemaSerf,8.0,"“McMurphy” (Jack Nicholson) is a veteran with an attitude who has pled insanity to escape his latest court appearance on a charge of statutory rape. He is sent to an evaluation hospital where they are to decide just what, if anything, is wrong with him. His smart-assed confidence endears him to some of his fellow inmates, especially the impressionable “Billy” (Brad Dourif) but also earns him the instant enmity of the chief nurse “Ratched” (Louise Fletcher) who is used to ruling with a psychologi",2025-03-12
40096,movie,badelf,8.0,"This film is deeply steeped in Brazilian culture, which may make it inaccessible to some. It's based on a play by Ariano Suassuna, who made his life's mission to preserve Brazilian culture. If you're put off by the surrealistic religion scenes, keep in mind that this spiritualism was still firmly anchored in Brazil in 2000, along with the mash-up of African beliefs - candomblé.

I loved the Laurel-and-Hardy style of comedy. The film was not short on laughs. The actors' comedic timing is spot o",2023-08-15
324857,movie,trineo03,,"First of all, I love the animation style in this film. The animation in this film is styled to look like an actual comic book. I think this approach for this kind of film was an excellent choice because we’ve all seen the usual kind of animation but nothing like this. To tie in with the animation I need to talk about the action scenes in this film. These tie in with the animation because of the way the directors styled the action shots is to look like something in a comic panel. Most people don’",2018-12-17
324857,movie,Gimly,7.0,"It's true I liked it less than perhaps the vast majority of _Spider-Verse's_ audience, but this was still great, the animation enamouring, and the depth of its story and reference totally engaging. Not to me the best Spider-Man movie as many have said, (that honour still goes to _Homecoming_) but a blast all the same.

_Final rating:★★★½ - I really liked it. Would strongly recommend you give it your time._",2019-02-19
324857,movie,DohnJoe,,"My wife doesn’t care for Spider-Man at all - as Batman is her favorite superhero.

With that being said, she loves this movie to death, along with my son and I. It’s safe to say we’ve watched this movie over 10 times and we’ve shown it to all our friends. It’s a really great movie that promotes diversity, good animation, and has a great story. I highly recommend to all who are interested in watching.",2019-03-22
324857,movie,TomTag,7.0,"Spider-Man: Into the Spider-Verse (2018) is no ordinary Spider-Man movie, it contains multiple characters with the same powers in multiple dimensions.
 This is also not an ordinary animated movie. It has animated style we have never seen before. There were 177 animators and it took 1 week to animate 1 second and 1 year to nail down 10 seconds. Nowadays, animations are being made to look real but this movie was different. However, the creators wanted it to look like something new for viewers. Th",2019-05-06
324857,movie,Justin Lopez,,"Stan Lee would be proud! Great story, great message, and great animation.",2019-11-06
1891,movie,Ian Beale,4.0,"**Overrated **

An enjoyable film - just not as engaging as parts IV and VI. The argument that Jedi was ruined by little furry creatures is laughable as this instalment features a _little green muppet_. I was expecting Kermit and Miss Piggy to show up.

Once we get the impressive Hoth battle over with the film meanders and crawls along - padding out its running time with predictable romantic sparring and an extended and dull sequence on Degobah.

Things finally pick up again at Cloud City ",2017-02-16
1891,movie,mindfroth,10.0,"A masterpiece of cinema. The film transcends the franchise, seamlessly combining elements of myth, science fiction, fantasy, war film, romance, bildungsroman, epic and tragedy in a way that its sequels have been unable to replicate. It is a move without a moment of fluff. Cut anything and the film would suffer. Story, character, effects, cinematography, music, screenplay, acting, editing and action are all superb. One of the most artistically poignant films ever made. And because its style canno",2018-01-01
1891,movie,John Chard,10.0,"It's a dark time for the rebellion; and us the audience as well.

Luke, Leia and Han are fighting with the rebels in the hope of defeating the Imperial forces. But Luke gets a calling to the planet Dagobah, where under the tutelage of Jedi Master, Yoda, he hopes to become a Jedi himself, but that also brings him closer to his, and Leia's, destiny.

Lets tell it as it is, The Empire Strikes Back is a better film than Star Wars, not as impacting of course, but most definitely better. Technical",2019-07-21
1891,movie,Wuchak,7.0,"_**Fun, imaginative, iconic space adventure with a kick-axx cast**_

""Star Wars V: The Empire Strikes Back"" (1980) was the anticipated follow-up to the initial mega-hit blockbuster from 1977. It’s an epic, but simplistic space fantasy about an evil empire and the noble souls who dare to fight it. The main cast features Mark Hamill (Luke Skywalker), Harrison Ford (Han Solo), Carrie Fisher (Princess Leia), Billy Dee Williams (Lando Calrissian), Alec Guinness (Obi-Wan Kenobi) and the voice work o",2020-07-26
1891,movie,r96sk,9.0,"Terrific, again.

<em>'The Empire Strikes Back'</em> follows up on the greatness of <em>'Star Wars'</em> with a highly enjoyable sequel. This one feels like a big moment in the franchise, at least to someone who doesn't know what's upcoming, as we get sizeable moments alongside some cool character reveals.

Mark Hamill, Harrison Ford and Carrie Fisher continue to impress in their respective roles, as does James Earl Jones. Elsewhere, Billy Dee Williams and Frank Oz make for strong additions.",2021-02-01
255709,movie,izgzhen,7.0,"This movie is a mixture of many social topics that concern us, being organized coherently into a deeply touching narrative. It reveals many imperfections of the world we lived in, but the main theme is still about hope and love. While the plot is relatively simple, the acting feels truly impressive because of the genuine feelings between the lines.",2017-09-29
255709,movie,Alunauwie,10.0,"Based on a true story, Hope follows the traumatic journey of a young girl, So-won, who survives a brutal sexual assault and must rebuild her life amid a deeply flawed justice system. Despite immense physical and emotional pain, her courage and the love of her family highlight the resilience of the human spirit. The film powerfully criticizes legal leniency for predators and calls for greater empathy, protection, and support for victims.

Read the full review here: (Indonesian version : alunauw",2025-09-12
4935,movie,Andres Gomez,9.0,Really good movie staging in a fictional center European country. The drawings are great and the story is as delicate as any other from Miyazaki.,2013-11-26
4935,movie,CinemaSerf,8.0,"Certainly my favourite Miyazaki film. The animations are a touch angular, but colourfully and stylishly depict this story of a beautiful young girl who is cursed by an evil witch. In despair, she sets off, directionless, from home and comes across ""Howl"" and his moving castle - and the sprite ""Calcifer"". She begins a journey of discovery - about herself as much as anything. ""Howl"" - the ultimate free spirit is also facing down demons of his own that he is struggling to reconcile with. ""Calcifer""",2023-09-04
378064,movie,Reno,7.0,"**A second chance to fix the past mistake.**

This is the next best anime in the recent time after 'Your Name'. Not that you know this director very well, not at the international level. But with a film like this, she's going to be. This is another teen romance. Well, romance is not exactly a word that matches with what this film is about narrative, but there's no other way to describe its theme. It was like before romance, that mean before committing to a relationship and after you had starte",2017-07-30
378064,movie,tropicalicecedar,,"A Silent Voice: The Movie (2016) is an absolute gem! 🌟 This beautifully crafted anime film takes you on an emotional rollercoaster, touching your heart and leaving you with a sense of hope and understanding. The characters are so well-developed, and the animation is simply breathtaking. Prepare to be moved and inspired by this poignant story of redemption, forgiveness, and the power of empathy. Highly recommend it for anyone looking for a touching and meaningful cinematic experience!",2023-07-26
378064,movie,tmdb71757354,10.0,"**A film that changed my vision of the life**

""A Silent Voice"" is a film that has changed my vision of the life, understanding better the importance of the human communications. Including profound reflections related to empathy, self-esteem, redemption, self-improvement, and the importance of understanding and listening to others.

This film was truly made with love. Because it has a Sound-Track, thought and composed as if they were simulating the stimuli that a deaf person can feel through",2024-09-13
378064,movie,Suhaixy,10.0,"""A Silent Voice"" is a film that has changed my vision of the life, understanding better the importance of the human communications. Including profound reflections related to empathy, self-esteem, redemption, self-improvement, and the importance of understanding and listening to others.

This film was truly made with love. Because it has a 
Sound-Track thought and composed as if they were simulating the stimuli that a deaf person can feel throughout his life, such as the touch of someone or th",2025-07-05
378064,movie,Alunauwie,10.0,"A Silent Voice is a powerful animated film that explores bullying, guilt, and emotional healing from both the victim's and the perpetrator's perspectives. Through strong character development and emotional storytelling, the film delivers a deep and relatable message, enhanced by beautiful animation and fitting music. Though animated, its mature themes make it more suitable for older audiences.

Read the full review here: (Indonesian version : alunauwie.com) and  (English version : uwiepuspita.",2025-09-30
311,movie,Andres Gomez,8.0,"Stereotypical Sergio Leone film with endless waitings and sight crossings.

One of the performances that made Robert de Niro de actor he is and an interesting way of telling a story and the evolution of America during the years of the alcohol prohibition.",2013-03-15
311,movie,Filipe Manuel Neto,8.0,"**It's an excellent film, which proves the importance of good post-production, and how bad editing can ruin the whole thing.**

There are certain films that impress us so much when we see them that we are really surprised when we discover how ignored they were by the great awards. This film is one of them: I was really shocked to find that it wasn't even nominated for an Oscar or a Golden Globe… and I had to read a bit to understand why that happened.

The film is perhaps one of the best in ",2022-10-10
311,movie,CinemaSerf,7.0,"Told by way of a really potent (and well scored by Morricone) retrospective, this sits us down and takes us through a forty year period in the life of the now down-at-heel ""Noodles"" (Robert De Niro) and of the development of the city of New York. The contents of an old briefcase serve as an aide memoire as the retrospective illustrates just how he and three of his childhood friends decided that the gutter was not for them, and that using the ""system"" to get on was the only way. Prohibition, viol",2023-05-25
807,movie,John Chard,10.0,"He's experienced about as much pain and suffering as anyone I've encountered, give or take, and he still has Hell to look forward to. 
 
""Warning: Spoilers""
 
Seven is directed by David Fincher and written by Andrew Kevin Walker. It stars Morgan Freeman, Brad Pitt, Gwyneth Paltrow, Kevin Spacey and R. Lee Ermey. Music is scored by Howard Shore and cinematography by Darius Khondji.

An unnamed US city and two cops are on the trail of a serial killer who kills his victims according to which ",2020-04-14
807,movie,Repo Jack,10.0,Se7en put David Fincher on the map with this uber-creepy mystery thriller. The crime scenes are so grisly Seven is often ranked with top horror movies. And the ending -- hoo boy. One of the best twists in modern movie history.,2020-10-28
807,movie,Manuel São Bento,10.0,"If you enjoy reading my Spoiler-Free reviews, please follow my blog @
https://www.msbreviews.com

I've never written or even thought about my favorite movies of all-time. I don't believe in having a definite Top10 or Top20 of every film I've ever seen. However, if I had to write this special list, I have no doubts that Se7en would be there. Obviously, this is a rewatch of the classic movie that impacted filmmaking and launched David Fincher's remarkable career (I also ignore the fact that Ali",2020-11-21
807,movie,testr,3.0,"Some creative kills and a decent atmosphere fail to obscure a vapid nihilism, rather meandering plot with a twist that makes little sense, and some quite nasty misogyny. Basically two or three admittedly masterful performances away from being nothing more than a padded ultra-violent bad Law and Order episode. The Brakhage-inspired title sequence is orders of magnitude better than the film itself. The hodgepodge of contextless references to classic literature doesn't make this any cleverer, eithe",2022-07-12
807,movie,CinemaSerf,8.0,"Morgan Freeman is the veteran detective ""Somerset"" who is saddled with the newly married rookie ""Mills"" (Brad Pitt) and sent to investigate quite possibly the most ghastly murder scene cinema has ever produced. A man has been force-fed beans until he, quite literally, burst! A missing slither of kitchen floor lino suggests the fridge had recently been moved and behind that they find a clue - one that suggests this man had committed one of the deadly sins (gluttony) and therefore it's reasonable ",2024-04-25
244786,movie,MJM,,"DISGUSTING NONSENSE...

*** This review may contain spoilers ***

I find it very sad that so many people - including so-called professional reviewers - have rated this crap so highly. I did not walk out (although I was greatly tempted to do so) but saw it to the end. A total waste of time.

Here's what might spoil it for you, should you believe the BS that's being spread around this stinking pile of excrement: It could have actually been OK if it hadn't been so laughably impossibly ridicul",2015-01-28
244786,movie,Andres Gomez,9.0,"Fantastic movie with a good cast with an impressive Miles Teller and a yet even more impressive J.K. Simmons. Decent script, great directing, selection of the repertoire and performances.

Just sit down, get a good audio system and enjoy one of the best movies of the 2010s.",2016-01-29
244786,movie,DanDare,5.0,"J K Simmons won an Oscar for Best Supporting Actor for his mean, bullying monster. Jazz teacher Terence Fletcher who abhors the words 'good job.'

Fletcher tells a tale about Charlie Parker and how doing a good job was not enough for him. Good job means mediocrity.

Yet Fletcher is a mediocre educator and his college seems not to have noticed this. Instead of being an inspiration his students fear him. He is a nasty tyrant and an incident from his past comes back to haunt him.

Miles Telle",2017-02-26
244786,movie,mattwilde123,9.0,"When I sat down to watch this film, I didn't know what to expect. I am not usually a fan of films about musicians but this was a brilliant and tense masterpiece. The story is of a very ambitious boy named Andrew (played by Miles Teller) who is a music student in New York. He aspires to be noticed by a prestigious music teacher named Fletcher (played by J.K. Simmons). As his wish starts becoming a reality, he realises the brutality of this teacher who continually pushes him with questionable meth",2017-03-09
244786,movie,Matthew Brady,10.0,"""There are no two words in the English language more harmful than good job"".

Whiplash follows are main character Andrew Neyman who is a young jazz drummer, single-minded in his pursuit to rise to the top of his elite east coast music conservatory. Plagued by the failed writing career of his father, Andrew hungers day and night to become one of the greats. Terence Fletcher, an instructor equally known for his teaching talents as for his terrifying methods, leads the top jazz ensemble in the sc",2020-01-27
27205,movie,ohlalipop,,"When I first saw the trailer for this film, I knew that this would attract a lot of attention. Of course having Leonardo in the lead role helped a lot. 


From the trailer, I already know some things. Dreams. All about dreams. But what about dreams? Who are the other people? At first, I didn't really understand what was going on. It was all very confusing to me. But as the movie progresses, I start to understand it and I wanted to watch some more and know more what will happen in the end. The",2017-02-09
27205,movie,tmdb44006625,8.0,"Whether you watch Inception as a heist movie, a redemption story, or a sci-fi action picture, Christopher Nolan's tour de force of dreams will absolutely work its magic over you. The fact that the film works on so many levels (literally) is an attest not only to the visual queues that make it easy for the audience to follow but to how much in control of all the intricacies its filmmaker had to be.",2019-03-09
27205,movie,Varya,,"Is there anyone on earth who doesn't like Christopher Nolan’s films? Inception is one of his masterpieces. It’s a science fiction film released in 2010 and written by undoubtedly one of the greatest directors in Hollywood, Christopher Nolan, the creator of such stunning films as ‘Memento’, ‘The dark knight’, Prestige’ and ‘Interstellar’. the cast is impressive: the main roles are played by Leo DiCaprio, Ken Watanabe, Joseph Gordon-Levitt, Marion Cotillard, Ellen Page, Tom Hardy, Dileep Rao, Cill",2019-10-17
27205,movie,Matthew Brady,9.0,"Ariadne: ""Why is it so important to dream?""

Cobb: ""Because, in my dreams we are together.""

I haven't seen this movie in years, but after re-watching it struck me hard how depressing this was.

Putting aside the action sequences and loud music and a complicate plot, there's a beautiful story about a man trying to get back to his children, without it being cheesy. Well if you really break this movie at it's core, it's about two grieving men (Leo and Murphy), both haunted by the past until ",2020-01-27
27205,movie,Andre Gonzales,7.0,Crazy movie. I gotta watch a few more times I was confused. It would be sweet to build your own simulations though.,2023-07-04
12493,movie,CinemaSerf,7.0,"I didn't take to this initially. The scenario reminded me a little of an episode of ""Columbo"" - a rather sterile, studio-set environment that came across as quite limiting. Once it gets going, though, it's one of the best crime thrillers I've seen in ages. It all centres around the kidnapping of a small boy for whom the anger-prone, shoe millionaire ""Gondo"" (a strong contribution from Toshirô Mifune) is supposed to pay a ransom of ¥30 million - a colossal sum. It turns out, though, that it's not",2023-09-04
12493,movie,Zak_Jaggs,8.0,"A well worked, high stake crime thriller. The stakes are deeply personal to our main characters and puts them in an impossible situation. The performances and direction are very solid, the story is engaging and ultimately, it's a simple yet enjoyable film. Kurosawa comments on modern corporate greed and poverty in post-war Japan, and he does it very well.",2024-12-19
12493,movie,Brent Marchant,7.0,"I’m always amazed at how a single film can be fundamentally characterized in multiple ways, but that’s understandable when the picture combines an array of diverse elements, each of which has a validity all its own that can subsequently lead to different overarching interpretations. Such is the case with this 1963 film classic from famed Japanese auteur Akira Kurosawa, which provides the cinematic inspiration behind filmmaker Spike Lee’s current reimagination, “Highest 2 Lowest,” now playing the",2025-08-27
274,movie,Ted Fraraccio,10.0,"Unlike a lot of viewers, I first saw _The Silence of the Lambs_ at five years old. So, for me, _The Silence of the Lambs_ is a childhood favorite. Some would say I had an unusual childhood, in this age where some people actually **avoid** R-rated movies like the plague. The fact that I saw _Something Wild_, which Jonathan Demme directed five years before _The Silence of the Lambs_, as well as the original _Alien_ (alone at that), at the same age probably indicates that they were okay with me wat",2015-07-17
274,movie,Gimly,8.0,"This is one of a few movies I put off reviewing for years, because I honestly don't know what to say about a film this classic. So I'll be brief in my actual review, knowing that it comes from a place where I honestly believe that this is a movie that deserves its praise:

Even if the A-plot of the story wasn't one of the best crime thrillers put to screen, the Hannibal Lector moments alone would be enough to make _Silence of the Lambs_ a great movie, most especially his run in Memphis.

_Fi",2020-06-08
274,movie,Melissa Goldfine,,"It kind of reminds me of The Rocky Horror Picture Show, because Frank and Jame are drag queens who kill.",2020-11-18
274,movie,Repo Jack,10.0,"As a genre fan, there's a certain amount of satisfaction when a film is recognized by mainstream audiences. That's what it was like for me in 1992 when <i>Silence of the Lambs</i> swept the Oscar's (Best Picture, Director, Actor and Actress). 

And boy did the movie deserve it. Jonathan Demme's fantastic retelling of the classic book by Thomas Harris. Anthony Hopkins' scene-chewing Hannibal Lecter turned him into a pop culture icon (and unfortunately a slew of middling sequels). And Jodie Fost",2020-11-27
274,movie,Joseph Strickland,,"**Absolute Classic Film!
 I read the book before watching this thriller/horror classic film by Jonathan Demme. The film works on so many levels and at times feels very realistic in how it portraits law enforcers and the perverse criminals they pursue. Outstanding performances by Anthony Hopkins, Jodie Foster, Scott Glen, Ted Levine, etc.. I feel the director was influenced by Alfred Hitchcock's Psycho classic horror film by way of how grounded this film shows the deadly cat and mouse game and t",2022-08-06
567,movie,CharlesTheBold,,"L.B. Jeffries (Jimmy Stewart), an adventurous photographer, is temporarily immobilized by a serious leg injury.  Bored, and living in a time where TV and internet were not available as distractions, he watches the courtyard out his real window and speculates about the lives of the neighbors that he sees.  In particular, he wonders whether his neighbor Thorvald (Raymond Burr, who actually looks older than his later character Perry Mason) may have killed his wife.

Hitchcock examines the situati",2017-02-21
567,movie,John Chard,10.0,"It Had To Be Murder. 

L.B. Jefferies is a wheelchair bound photographer who by way of relieving his boredom, starts observing the lives of all his neighbours from his apartment window. As he gets deeper into the lives of all around him, he becomes convinced that one of hem has committed the act of murder, thus putting himself and those close to him in mortal danger.

Much like most of Alfred Hitchcock's other lauded pictures, Rear Window has been dissected, examined, appraised and written a",2020-02-11
