media_id,media_type,author,rating,content,created_at
1226863,movie,Manuel São Bento,7.0,"Full review: https://fandomwire.com/the-super-mario-galaxy-movie-review/

Rating: B+

""The Super Mario Galaxy Movie is a sequel that, while losing some of the narrative cohesion of its predecessor, gains massively in spectacle, ambition, and heart. Through animation that redefines the studio's standards and a Brian Tyler score that masterfully honors Nintendo's legacy, the film offers a memorable experience anchored by inspired vocal performances. For those who grew up with these characters,",2026-03-31
1226863,movie,Suhaixy,5.0,"**A film that could have had great potential**

As a huge Nintendo fan, I have to say that I found this film strange and hollow, with a lot of wasted potential.

It isn't like the first one, which at least had a basic structure to the main plot and some character development (I ended up liking the film). But this one doesn't even have a solid plot or character development. I have felt like I was watching fragmented scenes, which had disappointed me a lot; it could have a great story and be m",2026-04-01
1226863,movie,Chandler Danier,8.0,"This movie is stupid trash. You should know that before going in. You should know that without me telling you. There are rules for stupid trash:
1. Keep it short.
2. Have some cool shit in there.

This stupid trash is both short AND has cool shit.

Rosalina is so hot. I want to be a star baby sucking on her teat. Fox McCloud?!!! ARE YOU FUCKING KIDDING ME?!!!!! AHHHHHHHHHHHHHHHHHHHHHHHHHHHHHH!!!!!!!!! HOLY SHIIIIIIIT!! 

I watched this in Spanish because I wanted to see what 3D tech was ",2026-04-03
1226863,movie,Aadesh,,"YOU KNOW WHAT?
This movie is good because I watched it before and I liked gaming A LOT.
So, I rate it ⅚. Please make me more excited if you agree.
I rate it A tier.
Always a good movie, and fun.
Please make me more excited if you rate it a ⅚ or higher.
Good animation but a little bit off.
:)
THANKS FOR READING.",2026-04-04
1226863,movie,certifiedcritic,9.0,"It was engaging from start to finish.

My minor gripe is that they introduced a scene that was deemed controversial by fans and removed it from the games yet they decided to add it to the movie, ok lol. 

Other than that, every scene had the right amount of comedy, action, suspense, and dramatic shot transitioned perfectly.

The characters seemed much more themselves here than in the previous installment",2026-04-07
1318447,movie,Gudkarma,1.0,"Predictible. A silly and boring film, unfortunately. It could have been interesting but the landscape was the most interesting thing in the film.",2026-04-26
1318447,movie,Sierbahnn,7.0,"This might not be the most original thing in the world, but it is executed well and the characters are relatable enough to build tension. That makes the moments of fright more engaging and leaves you ultimately quite satisfied. The casting is fantastic, and of course the locales where this is shot are breathtaking. It's really not a bad movie, and I recommend it.",2026-05-03
1318447,movie,areyoukiddingme12,1.0,"Just awful.  I feel like I have already seen this movie a thousand times, and I did NOT even finish it.  Predictable, with no story.  No connection to the characters.  SKIP THIS ONE!",2026-05-03
936075,movie,CinemaSerf,7.0,"Given the whole slew of Jackson's involved in this stylish production, I couldn't help but feel a bit disappointed by the hollowness of the whole thing. Certainly Jaafar Jackson has something of his uncle's charm and childlike vulnerability, but were we not to have known he was a member of the actual family then I'm not sure I'd have been that convinced by his acting characterisation away from the dance floor. In any case, we begin with his ten year old (or is that eight?) younger years; with th",2026-04-23
936075,movie,Fernsjjf90,10.0,I super duper enjoyed the movie. It really brought back the Michael Jackson back from the grave. The fans of the whole wide world loved it. Antoine Fuqua did an excellent job not bringing the controversial of Michael Jackson. Just focusing uprising to the fame. I don't care what the critics say. Go and watch the movie yourself. Jaafar Jackson & Colman Domingo did excellent in the movie. my rating for the movie 9.5/10. You won't regret it from watching it all over again. Especially on IMAX format,2026-04-27
1314481,movie,Brent Marchant,8.0,"When 20 years pass between a movie and its sequel, a lot of disappointment can result when the follow-up is at last released. Derivative, underdeveloped story threads and an overreliance on nostalgic strolls down memory lane often abound, leaving viewers suitably underwhelmed, especially loyal fans of the source material. However, every so often, audiences are the lucky beneficiaries of pleasant surprises, movies that live up to their billing and come close to matching the magic of their predece",2026-05-02
1314481,movie,CinemaSerf,7.0,"Much as I did quite enjoy this, it isn't a patch on the first outing for those at ""Runway"" magazine two decades ago. It seems that boss ""Miranda"" (Meryl Streep) has somewhat lost her touch and after a major in-print faux-pas, she is on the defensive with a publisher who needs her to eat some humble pie and appease disgruntled advertisers. To make matters worse, he imposes a new features editor in the form of her erstwhile second assistant ""Andy"" (Anne Hathaway) who has recently been the victim o",2026-05-06
1325734,movie,CinemaSerf,7.0,"With just one week to go until their nuptials, the partially deaf 'Emma' (Zendaya) and 'Charlie' (Robert Pattinson) are nervously anticipating the big day. Planning is still incomplete as they sit down with friends 'Rachel' (Alana Haim) and her husband 'Mike' (Mamoudou Athie) for the onerous task of selecting the menu. The mushroom risotto seems to be a winner, though quite what was wrong with his idea of a cheeseburger I don't know, and so they turn their thoughts to the wine. A little tipsy, t",2026-04-08
1325734,movie,Brent Marchant,8.0,"Most of us are no doubt familiar with the expression “You think you know somebody,” an often-highly disillusioned reaction that arises when we become aware of some kind of previously unknown deception involving someone that runs contrary to our beliefs about that person’s nature. The impact can be severe, too, particularly when it relates to someone close and centers on an especially shocking revelation. So imagine what it must be like when one learns something appalling about one’s fiancée only",2026-04-11
1325734,movie,yyingac,9.0,"i think it is a lovely movie about finding love, in the shadow of guns though. 

love is when you do not need a reason to forgive. 

sweet and amusing!",2026-04-22
1304313,movie,Chris Sawin,4.0,"Lee Cronin’s The Mummy isn’t scary or memorable; it’s raunchy exploitation and over-orchestrated expired cheese. It is a horror film that reeks of nothing but ridiculousness. The sad part is there’s a decent enough concept buried somewhere within this vomit-drenched monstrosity and a killer ambiance that is borderline spine-tingling.

https://bit.ly/MummyBarf",2026-04-17
1304313,movie,CinemaSerf,6.0,"I had high hopes for this, but boy was I disappointed... Instead of getting Christopher Lee, Boris Karloff or even Arnold Vosloo - we get a modern day ""Carrie"" with a few bandages and a rehash of the ""Azazel"" story - only this time with a sarcophagus and lots of rusty chains. We begin when the young daughter of ""Charlie"" (Jack Reynor) and ""Larissa"" (Laia Costa) is abducted by someone at the bottom of their garden who has been grooming her with candy bars at their Cairo home. Despite the best eff",2026-04-24
1304313,movie,Sierbahnn,5.0,"We can all just say that this is Evil Dead, right? I mean, it is, in everything but name, with some flimsy other story tacked on over it. It is shot like Evil Dead, its dialogue fits the Evil Dead, the narrative is Evil Dead. It just happens to not be Evil Dead. 
And it is all the worse for it. Because it is NOT Evil Dead, and instead tries to say something else, but gets bogged down in its format, and becomes this bland, uninteresting goop. It is proficient, sure, but it is almost desperate, a",2026-05-08
1430077,movie,CinemaSerf,7.0,"Perhaps the vicar was just clearing his throat at his Christening, but anyway it's author ""Ohm"" (Adam Scott) who is about to conclude the final instalment of his legendary ""Conquistador"" trilogy when he is reminded that he still has the ashes of his parents in a cupboard, alongside a photograph of his mum leaning against a giant tree. He decides that the best place for them to rest is under that very tree, so he sets off to Ireland and a remote country hotel. His arrival gives him (and us) an id",2026-05-06
361743,movie,r96sk,9.0,"What an excellent sequel - I, in fact, like it more than its predecessor.

<em>'Top Gun: Maverick'</em> is fantastic, simply put. I was expecting it to be good, but it's actually much more enjoyable than I had anticipated. The callbacks to the original are expertly done, the new characters are strong/well cast, it has plenty of meaning, music is fab and the action is outstanding - the aerial stuff is sensational.

The story is superb, with each high stake coming across as intended - parts ev",2022-05-25
361743,movie,Manuel São Bento,9.0,"FULL SPOILER-FREE REVIEW @ https://www.msbreviews.com/movie-reviews/top-gun-maverick-spoiler-free-review

""Top Gun: Maverick is the return of pure, nostalgic blockbusters, instantly becoming one of this year's personal favorites. The best aerial action sequences ever amaze even the highest expectations, not only due to the absolutely insane real stunts but largely because of the flawless contribution of all filmmaking elements.

The surprisingly emotional screenplay helps Tom Cruise deliver ",2022-05-27
361743,movie,tmdb20895531,5.0,"A lot of things in this movie do not make sense, like ""why not use F-35?"", ""why didn't cruise missiles target enemy air defence and planes in hangars?"" to name a few. 

The original movie had some seriousness built into it, the sequel I think is closer to a comic book movie. Very similar to the original star wars, especially the action sequence at the end. Just a tad more realistic than black widow, you can clearly see the action comedy style of Marvel movies.

I think a lot of conservatives",2022-05-28
361743,movie,CinemaSerf,7.0,"It seems like I have been watching the trailers for this film for years now - and you know what? Yes - it was worth the wait. The film is all about some truly exhilarating aerial photography that culminates in some super dogfighting and a good old dose of nostalgia. Tom Cruise is very much in his element as the ageing - and frequently not afraid to look it - eponymous ""Top Gun"" pilot drafted in by a rather sceptical admiral to train up a new squad for a very perilous mission to destroy an underg",2022-05-30
361743,movie,Chris Sawin,6.0,"_Top Gun: Maverick_ is a sequel that is a leaps and bounds improvement over the original film. There’s better acting from the entire cast, more of an emotional attachment between at least two of the main characters in the film, and subtle humor that actually lands. But the film’s constant need to fly in the same flight pattern as the original film comes off as more of a restraint than a fond recollection.

The sequel seems to highlight many of the shortcomings of the original film, which in re",2022-06-02
550,movie,Goddard,,"Pretty awesome movie.  It shows what one crazy person can convince other crazy people to do.  Everyone needs something to believe in.  I recommend Jesus Christ, but they want Tyler Durden.",2018-06-09
550,movie,Brett Pascoe,9.0,In my top 5 of all time favourite movies. Great story line and a movie you can watch over and over again.,2018-07-05
550,movie,Manuel São Bento,8.0,"If you enjoy reading my Spoiler-Free reviews, please follow my blog @
https://www.msbreviews.com

David Fincher’s new film, Mank, is coming soon on Netflix, released six years after his latest installment, Gone Girl. Therefore, this week I’m reviewing five of Fincher’s movies. Se7en was the first one, and now it’s time for one of the most culturally impactful films of the 90s, Fight Club. This is another rewatch of another filmmaking classic, one that I was never able to absolutely adore like",2020-11-22
550,movie,r96sk,7.0,"I didn't enjoy this, pretty much at all, but still kinda appreciate how it all comes together. It's a weird one for me.

Overall, <em>'Fight Club'</em> underwhelmed me. I actually knew very little before viewing it, despite hearing about it on a surface level for years and years; well, one 'regulatory' part of it anyway. It's much deeper than I had expected. Unfortunately, I didn't find entertainment with any of it - it was, to be honest, a slog to sit through.

The only scene I can remember",2021-01-13
550,movie,rsanek,9.0,"I was mostly neutral on this movie until the last third, when things turned psychologically thrilling and gave me American Psycho vibes. The ""His name was Robert Paulson"" scene specifically was where the film turned from 3 starts to 4.5 stars. Would recommend and I intend to return to this in some time as I feel it has higher rewatchability than many films of this style.",2021-05-04
1408208,movie,Alunauwie,7.0,"Exit 8 adapts Kotake Create’s 2023 video game into a psychological loop that traps viewers in the same disorienting corridor as its protagonist, using shifting perspectives and symbolic typography to reflect inner guilt and trauma. While the repetitive structure and timeline inconsistencies may test patience, the film builds tension through the suffocating feeling of being stuck rather than through conventional scares. Ultimately, it delivers a reflective and immersive experience that favors emo",2026-02-28
1408208,movie,CinemaSerf,6.0,"When a rather asthmatic sounding young gent (Kazunari Ninomiya) gets off a subway train, he gets a call from his ex-girfriend telling him that she is in the hospital and that she is pregnant. What is he to do - especially as he has just witnessed a stroppy man on the packed train lose the plot with a mother and her young, screeching, babe-in arms and ignored it? He agrees to head to the hospital, and so heads for exit eight. Thing is, he never seems to get any nearer to it and after a while he s",2026-04-28
1418657,movie,MovieGuys,5.0,"It's always a shame when you can see the potential in something but it never quite gets there. The biggest single problem with ""The Yeti"" is it takes itself far too seriously, for what is, at the end of the day, a monster flick. If they had made the scares and deaths more in keeping with a black humour vibe rather than tragic, this would have been far more enjoyable. What's also missing is the sense of creeping dread, of pursuit, of trying to escape from something monumental and foreboding. 

",2026-04-16
1418657,movie,Patrick Martin Jr.,,"Movie Review: The Yeti (and what everyone is saying...)

There’s a certain charm to a stripped-down creature feature, and *The Yeti* (2026) leans hard into that tradition—sometimes successfully, often frustratingly. Directed by Gene Gallerano and William Pisciotta, this low-budget survival horror throws a small expedition into the frozen wilderness of Alaska, where a missing-persons mission quickly turns into a fight against a prehistoric predator. ([Wikipedia][1])

The premise is pure pulp:",2026-04-18
744,movie,r96sk,8.0,"You'll struggle to find a more cheesy film, even so <em>'Top Gun'</em> is a super film.

I need to check out more of Tony Scott's work because he has yet to let me down from the flicks of his that I've seen; on that note I'd put this below <em>'<a href=""https://letterboxd.com/film/crimson-tide/"" rel=""nofollow"">Crimson Tide</a>'</em> and <em><a href=""https://letterboxd.com/film/unstoppable-2010/"" rel=""nofollow"">Unstoppable</a>'</em>, but it is still one of his best I'm sure. The action is great",2022-05-24
744,movie,Manuel São Bento,7.0,"MORE REVIEWS @ https://www.msbreviews.com/

Rewatched Top Gun before seeing the sequel.

Its treatment of female characters clearly didn't age well, but I still had tons of fun. The aerial sequences remain exciting and the male camaraderie originates many memorable dialogues. Awesome score and iconic sunglasses.

Rating: B",2022-05-27
744,movie,CinemaSerf,6.0,"Back in 1986, ""Take My Breath Away"" was ubiquitous. It had airplay everywhere and made the band ""Berlin"" an household name. That is just about all, I have to say, that is memorable about this otherwise rather dull, testosterone driven, airborne adventure movie that really doesn't show these military elite in much of a good light. ""Maverick"" (Tom Cruise) is the aptly named hot-shot who is sent to the ""Top Gun"" flying school for the top 1% of the top 1%, where his individual style - along side his",2022-08-28
744,movie,Nathan,6.0,"Top Gun is incredibly cheesy but has a ton of heart leading me to fall in love with the characters of this film. The plot was a bit weak, but the connections and development these characters had is what really made me enjoy it. The action sequences with fighter jets were bad and filmed poorly where I had a hard time distinguishing what was happening in the air. I enjoyed my time on the ground much more, and that held it back quite a bit.

Score: 64%
Verdict: Decent",2023-01-06
1317149,movie,CinemaSerf,7.0,"I suppose there are bound to be some questions about whether or not this is acting or mimicry, but there’s no denying that the performance here from Robert Aramayo is truly engaging to watch. John Davidson is a confident and friendly young man from Galashiels in the Scottish Borders who might have a promising goalkeeping career looming until, at the age of 14, he develops an involuntary tic. This is swiftly followed by uncontrollable swearing and spontaneously violent gestures. His parents, whos",2025-10-15
1317149,movie,Brent Marchant,10.0,"They say you shouldn’t judge a book by its cover, because you just might be surprised by what’s inside. The same, of course, can be said for people, and that’s especially true when it comes to individuals with the rare and unusual condition known as Tourette Syndrome. And that’s precisely the point driven home by this excellent new fact-based comedy-drama from writer-director Kirk Jones. For those unfamiliar with Tourette, it’s a condition in which those affected exhibit potentially offensive an",2026-05-04
1242332,movie,Chris Sawin,7.0,"Normal is a flawed action film, but it uses its basic concept effectively. Its throwaway characters are used to a kick ass and bullet-heavy advantage while the action is swift, brutal, and doesn’t overstay its welcome. This is a bite-sized action film that delivers unabbreviated destruction.

https://bit.ly/BobNormal",2026-04-22
1102883,movie,CinemaSerf,6.0,"The eponymous rock star (Anne Hathaway - or perhaps Margot Robbie or Natalie Portman?) has had some sort of an incident with her erstwhile friend and fashion designer ""Sam"" (Michaela Coel) and so when she turns up unannounced at her home in the middle of a thunderstorm, she can't be too surprised that the reception she gets is just as wet. She needs a frock. A frock to end all frocks. She needs ""Sam"" to design it for her, as only she really understands her; knows her; yada yada... Barring a few ",2026-04-30
10835,movie,Filipe Manuel Neto,7.0,"**Action, lots of action, in a slow but elegant film.**

It was the first time, to my knowledge, that I saw a film made in Hong Kong. John Woo, its director, gained some international notoriety and would even, long after this film, have some work in western cinema. In general, I liked the movie. I'm not an undefeated fan of action cinema, but I felt that this film manages to balance the explosive action (even better and more intense than in North American films) with a satisfying script. The s",2023-06-19
1624961,movie,CinemaSerf,7.0,"Set against a backdrop of a busy Christmas and impending, pretty savage, redundancies from it’s Australian parent company, Northern Bank manager “Murray” (Eddie Marsan) is also facing discord at home from a wife (Eva Birthistle) who has had enough of him always being at, or obsessed with, work. Meantime, “Barry” (Éanna Hardwicke) is a jovial worker at the bank who regularly wanders around with the vault keys in his hands as he chats with his pals. The two men don’t exactly get on, but they are g",2026-04-01
1290792,movie,Leno,5.0,"A less sci-fi version of ""get out"", the movie follows an ex-convict former military who goes to a small town in Ohio after his family, only to find the town crowded with white supremacists who harvest organs from the black folk. The idea was great but the execution subpar. The movie tried to hard to be iconic and a few dialogs are just ridiculous. Overall an entertaining movie but be prepared to cringe in a few scenes. The ending was also very disappointing.",2026-04-28
55721,movie,Andres Gomez,5.0,I think the election of the cast is good and works well and the proposal for a story should work but this movie is just not funny ... or I don't fit in the profile of the target spectator.,2016-02-15
55721,movie,Andre Gonzales,8.0,Really funny chick flick. It's amazing what women fight about. To a guy none of what happened in this movie would make us act like that. Very entertaining to watch though.,2023-05-19
55721,movie,CinemaSerf,6.0,"When best friend “Lilian” (Maya Rudolph) announces that she is to marry, “Annie” (Kristen Wiig) is determined to be her maid of honour. Problem? Well her life is a shambles. She is having a relationship with the wealthy Porsche driver, her job isn’t exactly going well and she hasn’t two cents to rub together. Everyone knows that getting married is an expensive business and with the bachelorette party amongst the myriad of responsibilities she is vying to take, she is going to have to improvise! ",2026-01-06
1455079,movie,Brent Marchant,6.0,"They say that “imitation is the highest form of flattery,” but, when that sincere admiration begins teetering on the brink of becoming derivative, much of the magic and charm is lost. And that, for what it’s worth, is the downfall of this much-anticipated romantic comedy from director Kat Coiro, a filmmaker best known for her short subjects, music videos and TV work. Anna (Halle Bailey) is a twenty-something wannabe chef who’s been treading water as a New York City house sitter ever since the un",2026-04-09
1455079,movie,CinemaSerf,6.0,Anyone recall 'Made in Italy' (2020)? This has a similar vibe to it as it showcases the beauty of traditional rural Italian life as a backdrop to a quirkier than usual romance. 'Anna' (Halle Bailey) was an aspiring chef until her mother died from cancer and now she has rather lost her way (and her job and flat). Her best friend has been urging her to use her plane ticket to Italy but she has resisted until a chance hotel encounter with 'Matteo' (Lorenzo de Moor) in an hotel bar. He tells her eno,2026-04-15
876792,movie,CinemaSerf,6.0,"I was really quite disappointed with this rather dryly animated fantasy adventure. It all starts when poor old ""Mikami"" gets himself murdered and is reincarnated in another world where he is thrust into a maelstrom of adventures centring around the beautiful, but mysterious, Queen ""Towa"" of the small kingdom of ""Raja"". She has been served loyally for many years by the ogre warrior ""Hiro"" who now has his work cut out for him when she falls ill and their water supply appears to have become distinc",2023-01-24
1307373,movie,CinemaSerf,7.0,"“Taylor” (David Jonsson) has been told that early release might be in the offing if he can keep his nose clean for a few more weeks in prison. He generally keeps himself to himself, and offers the floor’s drug pedlars a short back and sides now and again in return for a supply of pills. When the newly arrived “Dee” (Tom Blyth) is put into his cell, the pair quickly seem to strike up a sort of friendship as the enterprising newbie sets up a shop trading everything from chocolate to drugs. Needles",2026-03-06
1242265,movie,CinemaSerf,,"When an unexploded WWII bomb is discovered right next door to London's Paddington railway station, the police race to evacuate the locale and to cordon everything off ready for the army bomb disposal team. That unit is commanded by 'Maj. Tranter' (Aaron Taylor-Johson), a veteran of the conflict in Afghanistan, who swiftly sets up safe zones and informs the chief superintendent (Gugu Mbatha-Raw) that this is a live device that might take a while to make safe. Meantime, somewhat serendipitously, a",2026-04-08
1363974,movie,CinemaSerf,6.0,"Well if there is no such thing as a free lunch, then there certainly isn't going to be a free holiday! That's what the enthusiastic friends of ""Rimuru"" discover when they arrive at an idyllic holiday island. A young woman, meantime, is having some problems with a pesky goblin ""Gobta"" but he turns out to be the least of her problems as she is also being followed by a mysterious group of armed and masked men. Circumstances force the two to unite for some gymnastic combat - but why are are they cha",2026-04-30
