media_id,media_type,author,rating,content,created_at
103663,movie,tmdb15435519,10.0,"Viewers beware: this is not an easy or light watch.

Mads Mikkelsen absolutely kills it as a somewhat lonely single man, who suddenly finds love and welcomes his son to live with him.

That's all I'll reveal in the review, no spoilers here.

But again, this isn't a light film, nor should it be. This tackles the subject matter with the poise it deserves, with stunning performances from Mads as well as the entire supporting cast. The script and cinematography lend themselves perfectly to the",2021-04-15
103663,movie,r96sk,5.0,"Happy to file this one under 'Films I Evidently Didn't Get'.

<b>[Edit: I can't lie, I'm absolutely waffling below. Apologies in advance and totally feel free to ignore, I just typed whatever came into my head because I'm simply so unsure about this. I've articulated myself awfully I'm positive, way too many paragraphs and all that but hey-ho.]</b>

I don't even know where to start with <em>'The Hunt'</em>, I'm finding it difficult to seperate my thoughts. On the one hand I dislike a lot abo",2023-10-14
103663,movie,ARGMAN,7.0,"""Don't accuse someone of thing with ignorance, you'll regret it later"" - Quran",2024-03-02
103663,movie,CinemaSerf,7.0,"Although this is set amidst a small rural community, it could just as easily transfer to any society where a small white lie can lead to a misunderstanding that brings out the vigilante in any of us. That’s the situation that primary school teacher “Lucas” (Mads Mikkelsen) finds himself in when the young daughter of his childhood friend “Theo” (Thomas Bo Larsen) makes a remark that turns this otherwise peaceable community into something distinctly hostile. You can probably guess that nature of t",2025-02-15
531428,movie,SWITCH.,10.0,"As the credits began to roll on ‘Portrait of a Lady on Fire’, I was practically incapable of moving or speaking. Every time I didn’t think the film could possibly get any better, Céline Sciamma elevated it to even greater, more incomprehensible heights, culminating in one of the most extraordinary moments in 21st-century cinema. This is a rare and precious film, breathtaking in its craft and intensely honest in its passions. This is a film that aches, that longs, that dances in ecstasy and raise",2019-08-16
531428,movie,Heloisa,10.0,The best LGBT movie ever. And that's on period luv.,2020-01-14
531428,movie,Louisa Moore - Screen Zealots,10.0,"Céline Sciamma, writer and director of “Portrait of a Lady on Fire,” calls her period film a “manifesto on the male gaze.” This is the most accurate, elegant description of her story of a romance between two French women in the late 1700s. This is an impeccably detailed, beautifully acted, refined drama with a strong feminist angle that’s as stirring as it is thought-provoking.

Marianne (Noémie Merlant) is commissioned to paint the wedding portrait of Héloïse (Adèle Haenel), a young woman who",2020-03-27
531428,movie,tmdb92312096,9.0,Undoubtedly worth a watch; who knew portraits were the Tinder of the 1700s.,2020-07-31
531428,movie,beyondthecineramadome,10.0,"Full review: <a>https://www.tinakakadelis.com/beyond-the-cinerama-dome/2021/12/28/paint-me-like-one-of-your-french-girls-portrait-of-a-lady-on-fire-review<a>

Celine Sciamma’s fourth feature film, _Portrait of a Lady on Fire_, is a triumph. Few romance movies capture the totality of love, loss, and remembrance in the way Sciamma does in this film. The story is simple: Marianne (Noémie Merlant) has been hired to paint a portrait of Heloise (Adèle Haenel) to be sent to the Milanese nobleman she ",2022-06-20
655,movie,CinemaSerf,7.0,"Harry Dean Stanton is on cracking form here the amnesiac ""Travis"". He turns up in a Texan clinic dressed in a striped suit, but recalling little for the slightly roguish doctor who helps him after some dehydrating time in the desert to use to help identify him. A tiny scrap of paper in his wallet enables him to, though, and soon ""Walt"" (Dean Stockwell) arrives to try and get his long-lost brother back to his own home in Los Angeles. As the story now gradually unfolds, we discover that ""Travis"" h",2022-07-31
655,movie,Filipe Manuel Neto,7.0,"**A film full of qualities, but which will not please the general public.**

There are films that are made for commercial audiences and others that are clearly made to please specialized critics and film theorists. Although this film was present on the commercial circuit, the truth is that Wim Wenders directed this film for critics and film festival audiences, and this explains why critics love it and why the general public hardly knows this work. . About me? To be quite honest, I didn't parti",2024-03-12
655,movie,Axel,6.0,"I discovered Paris, Texas through Letterboxd's Top 250 Films with Most Fans, having never heard of it before. The 8.1 IMDB rating caught my attention, so I decided to give this acclaimed film a shot.

What Worked

The film starts genuinely intriguing. Travis's complete silence in the opening act was captivating - Harry Dean Stanton delivers a convincing portrayal of someone emotionally hollowed out by four years of isolation. His emotionless face perfectly captures that shell-shocked quality",2025-06-12
655,movie,Wuchak,4.0,"**_Artsy but tedious road flick in the Southwest_**

Written by Sam Shepard and shot in late 1983, this meshes elements of Coppola’s “The Rain People” with Paul Schrader’s “Hardcore” and a little “The Last Picture Show.” While it generally failed at the box office, it has since garnered an impressive following and is highly rated on the internet.

For me, it’s the least of those movies. Sure, it’s well made and artistic with creatively communicated messages, such as Travis’ meeting the “scre",2025-11-08
100,movie,BradFlix,,I just plain love this movie!,2013-12-01
100,movie,Andres Gomez,3.0,"Far from being a good movie, with tons of flaws but already pointing to the pattern of the whole Ritchie's filmography.",2014-04-24
100,movie,David Perkins,9.0,"Genuinely one of my favorite movies of all time. Watched again recently and realised how well written, brilliantly shot, beautifully cast and cleverly produced this movie actually is!",2017-01-09
100,movie,r96sk,8.0,"The very entertaining ending makes this film.

I wasn't sure about <em>'Lock, Stock and Two Smoking Barrels'</em> up until that point. Like, don't get me wrong, it is a good film from the get-go but I wasn't personally convinced by it to be more than that until the credits rolled - at which point, I found myself to have been thoroughly entertained.

With Guy Ritchie in his directing debut and a whole host of familiar British faces, it isn't a difficult film to get into. I did feel at some po",2022-03-16
600354,movie,Manuel São Bento,10.0,"If you enjoy reading my Spoiler-Free reviews, please follow my blog @
https://www.msbreviews.com

I've watched some incredible films during my life. Some offered me a blast of pure entertainment, others left me crying like a baby, and dozens made me laugh uncontrollably. Nevertheless, the most memorable movies are the ones that profoundly impact me emotionally either by remembering me of a past phase of my life or by possessing main characters who I can strongly relate to. What might be ""just",2021-02-24
600354,movie,Louisa Moore - Screen Zealots,6.0,"“The Father” gives its audience a fully immersive experience with the frustrations of dementia in this stage-to-screen adaptation of Florian Zeller‘s 2012 play. Making his feature film directorial debut, Zeller gives the project a personal touch with much emotional gravity, as he’s so intimate with the source material. The film has the look and feel of a stage play, but it thrusts audiences into the main character’s head in a way that only the medium can achieve.

Anthony (Anthony Hopkins) is ",2021-03-09
600354,movie,SWITCH.,8.0,"'The Father' is a standout during this very bland awards season, but just because it's both a critical darling and awards frontrunner doesn't take away from the emotional power and stellar performances for Colman and Hopkins.
- Chris dos Santos

Read Chris' full article...
https://www.maketheswitch.com.au/article/review-the-father-a-deeply-moving-look-at-mental-illness",2021-03-18
600354,movie,r96sk,9.0,"Incredible performances from Anthony Hopkins and Olivia Colman!

<em>'The Father'</em> makes for a rather heart-breaking watch, it's very clear from the get-go where the film is heading but that doesn't stop it hitting directly in the feels. I've fortunately never been around someone with what this film depicts, yet it still came across as very realistic - based on what I have heard about the condition.

Hopkins is utterly superb in the lead role, which is what I expected given I had heard a",2022-02-25
600354,movie,AstroNoud,9.0,"‘The Father’ is an incredibly moving film that leaves you as confused in time and place as the main character (an incredible Hopkins), allowing the audience to experience - if only a little - what it must feel like to have dementia.

9/10",2022-02-26
996,movie,talisencrw,10.0,"It's definitely hard to pin down a personal favourite Wilder film, though I tend towards his earlier masterworks such as 'The Lost Weekend', 'Sunset Boulevard'...and THIS. He was one of the finest at getting straight through the bullshit and to the heart of all things noir (as the immortal Jean-Luc Godard stated, 'All I need to make a film is a man, a girl and a gun'). 

Barbara Stanwyck is one of my favourite actresses of the period, and is a classic 'femme fatale'. I've never been a huge fan",2016-09-22
996,movie,John Chard,10.0,"A banner movie from film noir's classic era.

Double Indemnity is directed by Billy Wilder and Wilder co-adapts the screenplay with Raymond Chandler from the novella written by James M. Cain. It stars Fred MacMurray, Barbara Stanwyck and Edward G. Robinson. Music is by Miklos Rozsa and cinematography by John F. Seitz.

For a film lover such as myself it feels redundant writing a review for Double Indemnity, because quite simply there's nothing to say that hasn't been said already. The esteem",2017-11-05
996,movie,dogstir,10.0,"Perhaps the single best example of a film noir movie, _Double Indemnity_ (1944), stars Fred MacMurray, Barbara Stanwyck, and Edward G. Robinson. Based on a novel written by James Cain, the screenplay was co-written by Billy Wilder and the amazing Raymond Chandler.

Set in 1938 California, the story is based on the true-life 1927 murder of a married Queens, New York woman's husband who was killed by the woman's boyfriend after she took out a large insurance policy that contained a double-indemn",2021-02-23
996,movie,JPV852,9.0,"Very well done film noir from the 1940s with great performances by Fred MacMurray, Barbara Stanwyck and Edward G. Robinson along with good photography and direction from Billy Wilder. I've seen this one before but it's been at least 20 years though coincidentally, a scene from this was in a movie I recently watched (another re-watch) in Femme Fatale. **4.5/5**",2022-05-22
996,movie,CinemaSerf,8.0,"So poor old Tom Powers is married to the cold and calculating ""Phyllis"" (Barbara Stanwyck). When she starts to have an affair with his charismatic insurance broker ""Walter"" (Fred MacMurray) the two alight on a cunning plan to dispose of him and to claim the life insurance money. Being in the know about these things, ""Walter"" figures out a way in which they can double the payout. With their hands still rubbing together, the man's body is found on a railway track and when the police believe it acc",2022-06-30
508442,movie,Manuel São Bento,9.0,"If you enjoy reading my Spoiler-Free reviews, please follow my blog @
https://www.msbreviews.com

Out of my Top15: Most Anticipated Movies of 2020, eight were removed from this year's schedule due to the current global pandemic, so I didn't have that many films for which I felt incredibly excited. I love pretty much everything that Pixar puts out, and at the start of 2020, I noticed that the studio was releasing not one but two original animated movies, something quite uncommon in their histo",2020-12-14
508442,movie,rlaphoenix,10.0,"This is my favorite Disney Pixar movie, even beating Monster's Inc!

There wasn't a minute where I wasn't enjoying the movie, there's very powerful meaning to this movie (that will go over kids' heads) and for once, it (in my opinion) tackles an issue big with teens and adults more than kids (at least more than usually).

The movie's message is (from what I understood it anyway) about anxiety, sadness, and fear of how you choose your life path. Even going as far as showing how you're so-call",2020-12-25
508442,movie,SWITCH.,9.0,"In a year where most of us have been trapped indoors, the timing of 'Soul's' release can be seen as either a blessing or a curse. For some, it will act as a calming balm for a tough year; the perfect vehicle for inducing a good cry. Others, on the other hand, may reject it as yet another unnecessary mirror held up to their biggest fears exacerbated by a year where living with perceived “purpose“ has been near impossible. No matter which side of this you fall on, 'Soul' implores you to find beaut",2020-12-29
508442,movie,Ricardo Oliveira,,"Soul is the latest effort by Disney Pixar, a beautiful and wonderful film that will leave anyone to ponder about life, its value and the magic inherent in existence. 

The film tells the story of a man who accidentally falls into a ditch and ""dies"". However, he does not accept his death and begins a journey into his own afterlife until he is able to reunite with his body, in a coma on earth. 

For a children's film, Soul is surprisingly deep, perhaps even too deep, especially for a child. Th",2021-01-07
508442,movie,Kamurai,7.0,"Really good watch, would watch again, and can recommend.

I'll have to admit, I went into this thinking it would be Disney's yearly racist progressive attempt, so the bar was pretty low.

The movie is actually delightful, and shockingly deep.  The title indicates it has to do with the human soul, so I was expecting something along the lines of ""Inside"" or having to do with jazz, and while it has a rather nice combination of those two things, the attempt on the deep inner workings of the univ",2021-01-11
398818,movie,jessetaylor,9.0,"Alongside _Weekend_ and _Moonlight_, _Call Me By Your Name_ is the greatest queer film I have seen in the past ten years. It's a gorgeous, quiet masterwork - Luca Guadagnino has given us something truly special here. I'll cherish this one for a long, long time as it's extremely human and very personal. The fact that the legendary James Ivory wrote the screenplay for this shoots this over the top and slam dunks it into the cinematic stratosphere. Truly stunning work that deserves to be remembered",2017-09-15
398818,movie,tmdb15214618,8.0,"A near-perfect, timeless movie which will be responsible for many tears and yeast infections. Languid small-town living is captured perfectly, as is the tentative romance between the leads. I can't think of any substantive criticism until the last 25 minutes, when the movie becomes sloppy, less of a climax than a dissipation. (And personally, I'd have liked to see a sliver more of sexuality, which is oddly lacking.) Still, it's good. Watch it.",2018-01-07
398818,movie,CinemaSerf,7.0,"Amidst some beautiful Italian rusticity, we are introdcued to the ""Perlman"" family. It's the father (Michael Stuhlbarg) who has employed American ""Oliver"" (Armie Hammer) to help out with some research, and that involves living-in with his family of wife ""Annella"" (Amira Casar) and teenage son ""Elio"" (Timothée Chalamet) at their villa. Initially, they just call him ""later"" as that's his most often used expression as he takes his leave, but gradually they take to this man who appears to have depth",2024-08-11
1398,movie,Infra,,"This movie is like an onion, has multiple layers. To understand it, you have to be very careful and pacient. You have to focus on movie and not doing anything else while you watch it, because if you don't, you won't understand it. 

http://cinematol.ro/pareri-filme-stalker-calauza-1979/",2017-09-17
1398,movie,CinemaSerf,7.0,"This really is the cinematic equivalent of ""be careful for you wish for"". Two characters - a teacher and a professor, seek out a ""stalker"" who can lead them through the maze of challenges that culminates in an heavily restricted area know as the zone. Why? Rumour has it, that when in that zone you may make wishes that will immediately come true. What is this place? Is it real, imaginary, alien, all of these - or it is all just a cerebral hallucination of a place that, like El Dorado, we imagine ",2022-06-14
1398,movie,Filipe Manuel Neto,2.0,"**More style than content.**

This was my first contact with the cinematographic work of Andrei Tarkovsky, a Soviet filmmaker who would end his career outside his native country when he fell into disgrace for allegedly spending too much money on films that were not worthy of the expense. A regrettable attitude, but typical of countries that prefer to spend money on missiles than on support for culture and education, especially after considering how dangerous and insubmissive can be a cultured ",2023-05-31
1398,movie,CarsonTrent,10.0,"**Metaphysical themes explored in Stalker**

The three main characters are Archetypes: Writer, Professor (scientist) and Stalker (seeker).

One is the Stalker which is the seeker, a man searching for redemption which has faith ( Faith is an unreserved opening of one's mind to whatever the truth turns out to be / opposed to belief which is opening up to the truth as long as it fits with preconceived ideas and wishes). Stalker lives in a polluted industrial town which represents technological ",2025-12-23
38,movie,Andres Gomez,8.0,"Fresh and surprising with great script, dialogues and cut. The cast is also fantastic.",2015-02-10
38,movie,Wuchak,8.0,"***Inventive drama/romance with Jim Carrey, Kate Winslet and so much more***

A man (Jim Carrey) discovers that his babe (Kate Winslet) had her memory of their relationship removed via the medical procedures of an innovative company. He decides to get the surgery as well, but as the technicians (Mark Ruffalo & Elijah Wood) conduct the procedure he changes his mind! Can he escape with his memory intact and possibly save the relationship? Tom Wilkinson plays the doctor and Kirsten Dunst the secr",2019-11-20
38,movie,LovingStory,10.0,This was one of the first movies I really loved. Some moments are especially beautiful and I appreciate the folks who put in the labor to make this. Thank you,2021-02-17
38,movie,tensharpe,8.0,"“Eternal Sunshine of the Spotless Mind” is a movie that uses the fragility of memory and hurt of love to show the desperate measures taken by a couple who decide to break up. After two years of living together, Introverted Joel Barrish ( Jim Carey ) and extrovert Clementine Kruczynski ( Kate Winslet ) undertake extreme procedures to erase any memory of each other. 

What director Michel Gondry and Writer Charlie Kaufman have created is a movie designed to slowly release forgotten incidents and",2023-01-25
38,movie,Andre Gonzales,6.0,This is a really weird movie. I had to watch it about 3 or 4 times before you really figure it out. It's a good concept but a bit confusing sometimes.,2023-05-15
19,movie,Gurre,10.0,"Metropolis is one of the greatest films ever made. It's amazing set design, brilliant cinematography, groundbreaking special effects and futuristic story truly makes it one of the must-sees in cinema! 

It is set in the future, in a city called Metropolis where the citizens are divided into two groups: workers (who live under the ground and are working 10 hour shifts by enormous machines that keeps Metropolis working) and the royals (living in luxury in the great city on the surfice). And over",2014-05-31
19,movie,CinemaSerf,8.0,"This has got to be the ultimate cinematic illustration of the strata of human existence. Whether it be a story of the survival of the fittest; the cleverest; the most devious; most beautiful - or a hybrid of some/all - it reflects poignantly how humanity always seeks to exist within a hierarchical structure (merited or otherwise, but perfectly epitomised here by the matriarchal, deific robot), but how much more effectively mankind can succeed if it accepts and values everyone and works together.",2022-06-06
791373,movie,Manuel São Bento,7.0,"If you enjoy reading my Spoiler-Free reviews, please follow my blog @
https://www.msbreviews.com

After years of outstanding effort from passionate fans, Warner Bros. finally decided to give Zack Snyder the opportunity to finish his movie on his own terms. 2017's Justice League went through massive production issues - explained in my review of said film - and despite years of extremely tiresome, toxic discourse on social media, the famous Snyder Cut got a controversy-inducing budget to comple",2021-03-15
791373,movie,JPV852,7.0,"Definitely an improvement over the Whedon version and as a DC fan, enjoyed plenty of the character moments (and the addition of MM) but the story did feel off even though the film is nearly four hours long, in addition the alternate timeline part at the end felt tacked on and unnecessary. The visual effects looked like something from a video game but I can forgive that since I'd imagine it'd cost an additional $100M to make it look cleaner and more realistic.

Given what Snyder had to work wit",2021-03-18
791373,movie,sykobanana,9.0,"This is DC's best so far...easily.  
Although not flawless- there are a couple of scenes that didnt need to be included - this is the version that we needed to see.  
There is so much more time given to the characters in this, the plot is better thought out and structured, and Steppenwolf is no longer a joke.  There is actually an urgency in his battles with the JL now.  And OMG, Darkseid and Desaad look and sound boss.  
The recruitment is harder, the fight between the JL and Supes and then ",2021-03-20
791373,movie,Peter89Spencer,10.0,"I really, really REALLY wasn't expecting this - it felt like the extended edition of Lord of the Rings, if Zack Snyder directed it!
No, this was Zack Snyder's vision of Justice which we should've seen, if it wasn't for Joss Whedon hadn't pissed all over it. I mean, I understand why Snyder had to pull out the production, I really do, but Whedon could've had the decency to keep to heart on Snyder's work. Looking back, it was a total disrespect to the visionary director. This film...wow! It was tr",2021-03-20
791373,movie,Yassin_Raouf,10.0,"10/10 this is absolutely fantastic, just 1 word, #RestoreTheSnyderVerse",2021-03-24
843,movie,CinemaSerf,7.0,"This is a fine piece of cinema from Wong Kar-Wai that tells us a story of two people whom circumstance throws together - but not in a way you might expect. We start with two couples who move into a new building. One a newspaper man with his wife, the other a business executive and his wife. The businessman is rarely at home, nor is the journalist's wife - which leaves the other two at increasingly loose ends. It isn't long before a friendship develops - usually over some noodles - and though ent",2023-08-28
406,movie,CRCulver,7.0,"Matthieu Kassowitz's <i>La Haine</i> (Hate) is a portrait of youth disenfranchisement and the ensuing rage set in the public housing projects outside Paris. Before this film was released, many foreign viewers knew only the well-dressed, white, reserved and educated France depicted in e.g. films of the 1960s New Wave. Even many French people were unaware of the darker undercurrents of their own society, as no film had dared to handle this subject matter before. <i>La Haine</i> was a bombshell. Wh",2018-09-01
406,movie,CinemaSerf,7.0,"It's not so much the individual acting with this that stands out, it is the collective effort of all concerned to demonstrate to us just how perilous life can be on their Parisian suburban housing estate. Riots the evening before we arrive on the scene have left the area in a state of almost acute nervous exhaustion. The police are treading on egg shells and the community is a tinder box. To add to the volatility, a police officer lost his gun the night before and one of the locals ""Vinz"" (Vince",2023-08-27
406,movie,r96sk,8.0,"Very, very good movie!

<em>'La Haine'</em> is interesting slice of life viewing, I was intrigued across the whole 90 or so minutes as it tells its tale nicely. Some of the cinematography (b/w, smart choice) and editing is particularly impressive, while the ending is stark and unforgettable. The intentions of the film come across loud and clear.

I didn't overly connect with the main trio, aside from Hubert. I could also sense that something was on the horizon (didn't see it going exactly th",2024-09-17
823219,movie,Manuel São Bento,8.0,"FULL SPOILER-FREE REVIEW @ https://movieswetextedabout.com/flow-review-a-dialogue-free-tale-that-speaks-volumes/

""Flow is a celebration of resilience and collective spirit in times of adversity, as well as a potent reminder of the consequences of human actions on the environment.

With its immersive animation, emotional music, and unique narrative approach, Gints Zilbalodis invites viewers of all ages and backgrounds to reflect on the ability to adapt and unite - not just among species, but",2024-11-22
